[
  {
    "area": [
      "Practice Cloud Financial Management"
    ],
    "description": "Create a team (Cloud Business Office, Cloud Center of Excellence, or FinOps team) that is responsible for establishing and maintaining cost awareness across your organization. The owner of cost optimization can be an individual or a team (requires people from finance, technology, and business teams) that understands the entire organization and cloud finance.",
    "href": "https://docs.aws.amazon.com/wellarchitected/latest/cost-optimization-pillar/cost_cloud_financial_management_function.html",
    "id": "COST01-BP01",
    "lens": "FRAMEWORK",
    "pillar": "COST_OPTIMIZATION",
    "relatedIds": [],
    "risk": "HIGH",
    "title": "Establish ownership of cost optimization",
    "title_full": "COST01-BP01 Establish ownership of cost optimization"
  },
  {
    "area": [
      "Practice Cloud Financial Management"
    ],
    "description": "Involve finance and technology teams in cost and usage discussions at all stages of your cloud journey. Teams regularly meet and discuss topics such as organizational goals and targets, current state of cost and usage, and financial and accounting practices.",
    "href": "https://docs.aws.amazon.com/wellarchitected/latest/cost-optimization-pillar/cost_cloud_financial_management_partnership.html",
    "id": "COST01-BP02",
    "lens": "FRAMEWORK",
    "pillar": "COST_OPTIMIZATION",
    "relatedIds": [],
    "risk": "HIGH",
    "title": "Establish a partnership between finance and technology",
    "title_full": "COST01-BP02 Establish a partnership between finance and technology"
  },
  {
    "area": [
      "Practice Cloud Financial Management"
    ],
    "description": "Adjust existing organizational budgeting and forecasting processes to be compatible with the highly variable nature of cloud costs and usage. Processes must be dynamic, using trend-based or business driver-based algorithms or a combination of both.",
    "href": "https://docs.aws.amazon.com/wellarchitected/latest/cost-optimization-pillar/cost_cloud_financial_management_budget_forecast.html",
    "id": "COST01-BP03",
    "lens": "FRAMEWORK",
    "pillar": "COST_OPTIMIZATION",
    "relatedIds": [],
    "risk": "HIGH",
    "title": "Establish cloud budgets and forecasts",
    "title_full": "COST01-BP03 Establish cloud budgets and forecasts"
  },
  {
    "area": [
      "Practice Cloud Financial Management"
    ],
    "description": "Implement cost awareness, create transparency, and accountability of costs into new or existing processes that impact usage, and leverage existing processes for cost awareness. Implement cost awareness into employee training.",
    "href": "https://docs.aws.amazon.com/wellarchitected/latest/cost-optimization-pillar/cost_cloud_financial_management_cost_awareness.html",
    "id": "COST01-BP04",
    "lens": "FRAMEWORK",
    "pillar": "COST_OPTIMIZATION",
    "relatedIds": [],
    "risk": "HIGH",
    "title": "Implement cost awareness in your organizational processes",
    "title_full": "COST01-BP04 Implement cost awareness in your organizational processes"
  },
  {
    "area": [
      "Practice Cloud Financial Management"
    ],
    "description": "Set up cloud budgets and configure mechanisms to detect anomalies in usage. Configure related tools for cost and usage alerts against pre-defined targets and receive notifications when any usage exceeds those targets. Have regular meetings to analyze the cost-effectiveness of your workloads and promote cost awareness.",
    "href": "https://docs.aws.amazon.com/wellarchitected/latest/cost-optimization-pillar/cost_cloud_financial_management_usage_report.html",
    "id": "COST01-BP05",
    "lens": "FRAMEWORK",
    "pillar": "COST_OPTIMIZATION",
    "relatedIds": [],
    "risk": "LOW",
    "title": "Report and notify on cost optimization",
    "title_full": "COST01-BP05 Report and notify on cost optimization"
  },
  {
    "area": [
      "Practice Cloud Financial Management"
    ],
    "description": "Implement tooling and dashboards to monitor cost proactively for the workload. Regularly review the costs with configured tools or out of the box tools, do not just look at costs and categories when you receive notifications. Monitoring and analyzing costs proactively helps to identify positive trends and allows you to promote them throughout your organization.",
    "href": "https://docs.aws.amazon.com/wellarchitected/latest/cost-optimization-pillar/cost_cloud_financial_management_proactive_process.html",
    "id": "COST01-BP06",
    "lens": "FRAMEWORK",
    "pillar": "COST_OPTIMIZATION",
    "relatedIds": [],
    "risk": "MEDIUM",
    "title": "Monitor cost proactively",
    "title_full": "COST01-BP06 Monitor cost proactively"
  },
  {
    "area": [
      "Practice Cloud Financial Management"
    ],
    "description": "Consult regularly with experts or AWS Partners to consider which services and features provide lower cost. Review AWS blogs and other information sources.",
    "href": "https://docs.aws.amazon.com/wellarchitected/latest/cost-optimization-pillar/cost_cloud_financial_management_scheduled.html",
    "id": "COST01-BP07",
    "lens": "FRAMEWORK",
    "pillar": "COST_OPTIMIZATION",
    "relatedIds": [],
    "risk": "MEDIUM",
    "title": "Keep up-to-date with new service releases",
    "title_full": "COST01-BP07 Keep up-to-date with new service releases"
  },
  {
    "area": [
      "Practice Cloud Financial Management"
    ],
    "description": "Implement changes or programs across your organization to create a cost-aware culture. It is recommended to start small, then as your capabilities increase and your organization\u2019s use of the cloud increases, implement large and wide ranging programs.",
    "href": "https://docs.aws.amazon.com/wellarchitected/latest/cost-optimization-pillar/cost_cloud_financial_management_culture.html",
    "id": "COST01-BP08",
    "lens": "FRAMEWORK",
    "pillar": "COST_OPTIMIZATION",
    "relatedIds": [],
    "risk": "LOW",
    "title": "Create a cost-aware culture",
    "title_full": "COST01-BP08 Create a cost-aware culture"
  },
  {
    "area": [
      "Practice Cloud Financial Management"
    ],
    "description": "Quantifying business value from cost optimization allows you to understand the entire set of benefits to your organization. Because cost optimization is a necessary investment, quantifying business value allows you to explain the return on investment to stakeholders. Quantifying business value can help you gain more buy-in from stakeholders on future cost optimization investments, and provides a framework to measure the outcomes for your organization\u2019s cost optimization activities.",
    "href": "https://docs.aws.amazon.com/wellarchitected/latest/cost-optimization-pillar/cost_cloud_financial_management_quantify_value.html",
    "id": "COST01-BP09",
    "lens": "FRAMEWORK",
    "pillar": "COST_OPTIMIZATION",
    "relatedIds": [],
    "risk": "MEDIUM",
    "title": "Quantify business value from cost optimization",
    "title_full": "COST01-BP09 Quantify business value from cost optimization"
  },
  {
    "area": [
      "Expenditure and usage awareness",
      "Governance"
    ],
    "description": "Develop policies that define how resources are managed by your organization and inspect them periodically. Policies should cover the cost aspects of resources and workloads, including creation, modification, and decommissioning over a resource\u2019s lifetime.",
    "href": "https://docs.aws.amazon.com/wellarchitected/latest/cost-optimization-pillar/cost_govern_usage_policies.html",
    "id": "COST02-BP01",
    "lens": "FRAMEWORK",
    "pillar": "COST_OPTIMIZATION",
    "relatedIds": [],
    "risk": "HIGH",
    "title": "Develop policies based on your organization requirements",
    "title_full": "COST02-BP01 Develop policies based on your organization requirements"
  },
  {
    "area": [
      "Expenditure and usage awareness",
      "Governance"
    ],
    "description": "Implement both cost and usage goals and targets for your workload. Goals provide direction to your organization on expected outcomes, and targets provide specific measurable outcomes to be achieved for your workloads.",
    "href": "https://docs.aws.amazon.com/wellarchitected/latest/cost-optimization-pillar/cost_govern_usage_goal_target.html",
    "id": "COST02-BP02",
    "lens": "FRAMEWORK",
    "pillar": "COST_OPTIMIZATION",
    "relatedIds": [],
    "risk": "HIGH",
    "title": "Implement goals and targets",
    "title_full": "COST02-BP02 Implement goals and targets"
  },
  {
    "area": [
      "Expenditure and usage awareness",
      "Governance"
    ],
    "description": "Implement a structure of accounts that maps to your organization. This assists in allocating and managing costs throughout your organization.",
    "href": "https://docs.aws.amazon.com/wellarchitected/latest/cost-optimization-pillar/cost_govern_usage_account_structure.html",
    "id": "COST02-BP03",
    "lens": "FRAMEWORK",
    "pillar": "COST_OPTIMIZATION",
    "relatedIds": [],
    "risk": "HIGH",
    "title": "Implement an account structure",
    "title_full": "COST02-BP03 Implement an account structure"
  },
  {
    "area": [
      "Expenditure and usage awareness",
      "Governance"
    ],
    "description": "Implement groups and roles that align to your policies and control who can create, modify, or decommission instances and resources in each group. For example, implement development, test, and production groups. This applies to AWS services and third-party solutions.",
    "href": "https://docs.aws.amazon.com/wellarchitected/latest/cost-optimization-pillar/cost_govern_usage_groups_roles.html",
    "id": "COST02-BP04",
    "lens": "FRAMEWORK",
    "pillar": "COST_OPTIMIZATION",
    "relatedIds": [],
    "risk": "LOW",
    "title": "Implement groups and roles",
    "title_full": "COST02-BP04 Implement groups and roles"
  },
  {
    "area": [